{
  "active_experiment_id": null,
  "completed_experiments": 123,
  "cycle_number": 328,
  "generation": 2,
  "last_experiment_id": "EXP-20261006-0001",
  "last_failure_at": "2026-09-05T13:10:07Z",
  "last_literature_review_completed_experiments": 123,
  "last_reflection_completed_experiments": 122,
  "last_reflection_cycle": 319,
  "phase": "infrastructure",
  "protocol_version": 3,
  "schema_version": 1,
  "updated_at": "2026-10-06T03:02:21Z"
}
